<?xml version="1.0" encoding="UTF-8"?>
<?xml-stylesheet type="text/xsl" href="CANCIONXSL.xsl"?> 
<ballet xmlns:xsi="http://www.w3.org/2001/XMLSchema-instance" xsi:noNamespaceSchemaLocation="CANCIONXML.xsd">
	<titulo>The Best of Both Worlds</titulo>
	<autor>Hannah Montana</autor>
	<genero>Pop </genero>
<historia>
	    <acto>
			<escena>You get the limo out front (ooh-aah-ooh)</escena>	
		</acto>
		<acto>
			<escena>Don't ever say it's over if I'm breathin'</escena>			
		</acto>
		<acto>
			<escena>Been that ni* since I came out my mama (woo)</escena>		
		</acto>
</historia>
</ballet>